commit	combined_score	sharpe	mape	win_rate	n_trades	status	description
n/a	2.155171	2.926620	0.002003	0.846154	26	discard	tier3 iv_rv 1.5->1.55
n/a	2.249844	3.084409	0.002003	0.862069	29	discard	term_boost mult 100->80
PENDING	2.252048	3.088082	0.002003	0.862069	29	keep	tier2 rv_spike weight 1.0->0.7
n/a	2.251236	3.086728	0.002003	0.862069	29	discard	tier2 rv_spike 0.7->0.5
n/a	2.251037	3.086397	0.002003	0.862069	29	discard	tier1 rv_spike weight 1.0->0.8
PENDING	2.252405	3.088678	0.002003	0.862069	29	keep	pc_boost cap 0.70->0.68
n/a	2.251950	3.087919	0.002003	0.862069	29	discard	pc_boost cap 0.68->0.66
n/a	2.252251	3.088421	0.002003	0.862069	29	discard	pc_boost cap 0.68->0.69
n/a	2.252048	3.088083	0.002003	0.862069	29	discard	tier2 base 0.18->0.17
n/a	2.244119	3.074868	0.002003	0.888889	27	discard	remove skew_boost from tier3
n/a	2.150453	2.918756	0.002003	0.862069	29	discard	remove term_boost from tier3
n/a	2.250937	3.086231	0.002003	0.862069	29	discard	iv_premium multiplier on tier1
n/a	2.252405	3.088678	0.002003	0.862069	29	discard	skew_boost cap 0.5->0.3 (same score)
n/a	2.209657	3.017430	0.002003	0.812500	32	discard	low window 20d->15d
n/a	2.221001	3.036338	0.002003	0.857143	28	discard	low window 20d->25d
n/a	2.162774	2.939292	0.002003	0.862069	29	discard	remove pc_boost from tier2
n/a	2.252405	3.088678	0.002004	0.862069	29	discard	good IV filter 0.08-0.95 (same score)
n/a	2.245901	3.077837	0.002003	0.862069	29	discard	remove rv_spike from tier2
n/a	2.252290	3.088486	0.002003	0.862069	29	discard	tier2 rv_spike 0.7->0.8
n/a	2.251690	3.087486	0.002003	0.862069	29	discard	pc_boost mult 80->75
n/a	2.177798	2.964332	0.002003	0.857143	28	discard	tier1 ret_5d -0.015->-0.018
n/a	2.219390	3.033652	0.002003	0.838710	31	discard	tier3 ret_10d -0.06->-0.055
n/a	2.251875	3.087794	0.002003	0.862069	29	discard	tier1 skew_boost weight 0.8
n/a	2.251538	3.087232	0.002003	0.862069	29	discard	tier1 pc_boost weight 0.9
n/a	2.241635	3.070727	0.002003	0.925926	27	discard	tier2 ret_5d -0.040->-0.045
n/a	1.649534	2.083892	0.002003	0.764706	34	discard	atm_mask thresh 0.05->0.04
PENDING	2.252851	3.089420	0.002003	0.862069	29	keep	tier3 accel mult 0.9->1.0
n/a	2.251680	3.087469	0.002003	0.862069	29	discard	tier3 accel mult 1.0->1.1
PENDING	2.255099	3.093167	0.002003	0.862069	29	keep	tier3 accel cap 0.30->0.35
n/a	2.252437	3.088730	0.002003	0.862069	29	discard	tier3 accel cap 0.35->0.40
n/a	2.245955	3.077926	0.002003	0.862069	29	discard	tier3 accel offset 0.3->0.25
n/a	2.251494	3.087159	0.002003	0.862069	29	discard	tier3 accel offset 0.3->0.35
n/a	2.255099	3.093167	0.002003	0.862069	29	discard	tier3 ret_5d -0.005->-0.003 (same score)
n/a	2.255013	3.093024	0.002003	0.862069	29	discard	coherence power 1.25->1.30
n/a	2.255099	3.093167	0.002003	0.862069	29	discard	term_boost cap 1.0->0.8 (same score)
n/a	2.255099	3.093167	0.002003	0.862069	29	discard	OTM put strike 0.92->0.93 (same)
n/a	2.254957	3.092930	0.002003	0.862069	29	discard	tier1 base 0.16->0.15 (retry)
n/a	2.241100	3.069835	0.002003	0.862069	29	discard	add tier3 base 0.05
n/a	2.252456	3.088763	0.002003	0.862069	29	discard	tier2 pc_boost weight 0.9
n/a	2.254112	3.091522	0.002003	0.862069	29	discard	rv window 5d->4d
PENDING	2.255178	3.093299	0.002003	0.862069	29	keep	tier1 base 0.16->0.17
PENDING	2.255197	3.093331	0.002003	0.862069	29	keep	tier1 base 0.17->0.18
n/a	2.255157	3.093264	0.002003	0.862069	29	discard	tier1 base 0.18->0.19
n/a	2.254556	3.092262	0.002003	0.862069	29	discard	rv_spike mult 0.6->0.55
n/a	2.255089	3.093150	0.002003	0.862069	29	discard	tier2 base 0.18->0.19
n/a	2.254790	3.092653	0.002003	0.862069	29	discard	tier2 rv_spike 0.7->0.65
n/a	2.255197	3.093331	0.002003	0.862069	29	discard	tier3 accel trigger -0.01->-0.015 (same)
n/a	2.255195	3.093331	0.002010	0.862069	29	discard	ridge lambda 2e-4->3e-4
n/a	2.251694	3.087492	0.002003	0.862069	29	discard	add iv_short_div to tier1
PENDING	2.257686	3.097480	0.002003	0.862069	29	keep	remove low_scale from tier3 (dist_from_low already tight)
n/a	2.241671	3.070786	0.002003	0.862069	29	discard	remove coherence from tier3
n/a	2.257686	3.097480	0.002003	0.862069	29	discard	remove low_scale from tier2 (same score)
n/a	2.257017	3.096364	0.002003	0.862069	29	discard	tier3 accel cap 0.35->0.38
n/a	2.250030	3.084718	0.002003	0.862069	29	discard	tier3 term_boost weight 1.2
n/a	2.256438	3.095399	0.002003	0.862069	29	discard	tier3 term_boost weight 0.8
n/a	2.221556	3.037261	0.002003	0.862069	29	discard	remove low_scale from tier1
PENDING	2.258670	3.099119	0.002003	0.862069	29	keep	tier3 skew_boost weight 0.8
PENDING	2.270025	3.118044	0.002003	0.892857	28	keep	tier3 skew_boost weight 0.8->0.6
n/a	2.265515	3.110527	0.002003	0.892857	28	discard	tier3 skew_boost weight 0.6->0.4
n/a	2.267897	3.114497	0.002003	0.892857	28	discard	tier3 skew_boost weight 0.6->0.5
PENDING	2.271910	3.121185	0.002003	0.892857	28	keep	tier3 skew_boost weight 0.6->0.7
PENDING	2.272764	3.122608	0.002003	0.892857	28	keep	tier3 skew_boost weight 0.7->0.75
n/a	2.258670	3.099119	0.002003	0.862069	29	discard	tier3 skew_boost weight 0.75->0.80
n/a	2.258747	3.099247	0.002003	0.862069	29	discard	tier3 skew_boost weight 0.75->0.77
n/a	2.271824	3.121042	0.002003	0.892857	28	discard	tier3 accel cap 0.35->0.33
PENDING	2.273059	3.123100	0.002003	0.892857	28	keep	tier3 accel mult 1.0->1.05
PENDING	2.273323	3.123541	0.002003	0.892857	28	keep	tier3 accel mult 1.05->1.10
PENDING	2.273556	3.123929	0.002003	0.892857	28	keep	tier3 accel mult 1.10->1.15
893	2.273322	3.123539	0.002003	0.892857	28	discard	tier3 accel mult 1.15->1.20
894	2.246700	3.079170	0.002003	0.862069	29	discard	tier3 accel offset 0.3->0.25
895	2.271874	3.121125	0.002003	0.892857	28	discard	tier3 accel offset 0.3->0.35
896	2.255985	3.094644	0.002003	0.862069	29	discard	add rv_spike*0.3 to tier3
897	2.271551	3.120587	0.002003	0.892857	28	discard	term_boost mult 100->110
898	2.273644	3.124075	0.002003	0.892857	28	keep	term_boost mult 100->90
899	2.272994	3.122992	0.002003	0.892857	28	discard	term_boost mult 90->85
900	2.273824	3.124375	0.002003	0.892857	28	keep	term_boost mult 90->95
901	2.273824	3.124375	0.002003	0.892857	28	discard	term_boost cap 1.0->0.9 (no effect)
902	2.259712	3.100856	0.002003	0.862069	29	discard	tier3 skew_boost 0.75->0.80
903	2.272923	3.122874	0.002003	0.892857	28	discard	tier3 skew_boost 0.75->0.70
904	2.273741	3.124237	0.002003	0.892857	28	discard	pc_boost mult 80->82
905	2.273825	3.124376	0.002003	0.892857	28	keep	pc_boost mult 80->78
906	2.273742	3.124240	0.002003	0.892857	28	discard	pc_boost mult 78->76
907	2.231699	3.054166	0.002003	0.862069	29	discard	add pc_boost*0.3 to tier3
908	2.273754	3.124259	0.002003	0.892857	28	discard	rv_spike mult 0.6->0.65
909	2.273345	3.123577	0.002003	0.892857	28	discard	rv_spike mult 0.6->0.55
910	2.273112	3.123189	0.002003	0.892857	28	discard	rv_spike cap 0.3->0.25
911	2.142268	2.905116	0.002003	0.869565	23	discard	tier1 iv_rv 1.85->1.90
912	2.225918	3.044532	0.002003	0.838710	31	discard	tier1 iv_rv 1.85->1.80
913	2.273851	3.124420	0.002003	0.892857	28	keep	coherence power 1.25->1.20
914	2.273829	3.124384	0.002003	0.892857	28	discard	coherence power 1.20->1.15
915	2.273850	3.124419	0.002003	0.892857	28	discard	coherence power 1.20->1.22
916	2.269124	3.116542	0.002003	0.892857	28	discard	add down_conc to tier1
917	2.273133	3.123224	0.002003	0.892857	28	discard	tier2 rv_spike 0.7->0.6
918	2.273704	3.124175	0.002003	0.892857	28	discard	tier2 rv_spike 0.7->0.8
919	2.273142	3.123239	0.002003	0.892857	28	discard	skew_boost mult 0.9->0.85
920	2.259759	3.100934	0.002003	0.862069	29	discard	skew_boost mult 0.9->0.95
921	2.196420	2.995369	0.002003	0.892857	28	discard	near_atm mask 0.10->0.12
922	2.262086	3.104812	0.002003	0.892857	28	discard	near_atm mask 0.10->0.08
923	2.259400	3.100336	0.002003	0.862069	29	discard	OTM put threshold 0.92->0.90
924	2.273851	3.124420	0.002003	0.892857	28	discard	short_T threshold 25->20 days (identical)
925	2.273851	3.124420	0.002003	0.892857	28	discard	long_T threshold 40->50 days (identical)
926	2.273621	3.124037	0.002003	0.892857	28	discard	tier1 base 0.18->0.19
927	2.274020	3.124702	0.002003	0.892857	28	keep	tier1 base 0.18->0.17
928	2.274127	3.124880	0.002003	0.892857	28	keep	tier1 base 0.17->0.16
929	2.274170	3.124952	0.002003	0.892857	28	keep	tier1 base 0.16->0.15
930	2.274148	3.124915	0.002003	0.892857	28	discard	tier1 base 0.15->0.14
931	2.274045	3.124744	0.002003	0.892857	28	discard	tier2 base 0.18->0.17
932	2.273856	3.124429	0.002003	0.892857	28	discard	tier2 base 0.18->0.19
933	2.273673	3.124123	0.002003	0.892857	28	discard	pc_boost cap 0.68->0.65
934	2.272997	3.122996	0.002003	0.892857	28	discard	pc_boost cap 0.68->0.72
935	2.273058	3.123099	0.002003	0.892857	28	discard	add skew_boost*0.3 to tier2
936	2.273920	3.124536	0.002003	0.892857	28	discard	low_scale divisor 0.05->0.055
937	2.273480	3.123802	0.002003	0.892857	28	discard	low_scale divisor 0.05->0.045
938	2.247866	3.081112	0.002003	0.862069	29	discard	add base 0.05 to tier3
939	2.274167	3.124952	0.002010	0.892857	28	discard	ridge lambda 2e-4->3e-4
940	2.274170	3.124952	0.002004	0.892857	28	discard	ridge lambda 2e-4->1.5e-4 (identical)
941	2.274170	3.124952	0.002003	0.892857	28	discard	IRLS iterations 13->15 (identical)
942	2.274169	3.124952	0.002005	0.892857	28	discard	Cauchy scale 1.3->1.2
943	2.274170	3.124952	0.002003	0.892857	28	discard	IV filter lower 0.10->0.05 (identical)
944	2.271505	3.120511	0.002003	0.892857	28	discard	rv_spike offset 1.0->0.9
945	2.272226	3.121712	0.002003	0.892857	28	discard	rv_spike offset 1.0->1.1
946	2.272885	3.122811	0.002003	0.892857	28	discard	rv window 5d->3d
947	1.907667	2.514114	0.002003	0.833333	30	discard	tier2 ret_5d -0.040->-0.035
948	2.262765	3.105943	0.002003	0.961538	26	discard	tier2 ret_5d -0.040->-0.045
949	2.270253	3.118425	0.002003	0.892857	28	discard	tier1 coherence^2 blend
950	2.274170	3.124952	0.002003	0.892857	28	discard	skew_boost cap 0.5->0.45 (identical)
951	2.274170	3.124952	0.002003	0.892857	28	discard	skew_boost cap->0.40 (identical)
952	2.274170	3.124952	0.002003	0.892857	28	discard	skew_boost cap->0.30 (identical)
953	2.272363	3.121940	0.002003	0.892857	28	discard	skew_boost cap->0.20
954	2.273520	3.123868	0.002003	0.892857	28	discard	skew_boost cap->0.25
955	2.271607	3.120680	0.002003	0.892857	28	discard	add term_boost*0.3 to tier1
956	2.204233	3.008390	0.002003	0.888889	27	discard	tier3 ret_10d -0.06->-0.065
957	2.245448	3.077082	0.002003	0.866667	30	discard	tier3 ret_10d -0.06->-0.055
958	2.274170	3.124952	0.002003	0.892857	28	discard	tier3 dist_from_low 0.02->0.018 (identical)
959	2.274170	3.124952	0.002003	0.892857	28	discard	tier3 dist_from_low 0.02->0.015 (identical)
960	0.782143	0.638241	0.002003	0.862069	29	discard	tier3 dist_from_low 0.02->0.025
961	2.109611	2.850687	0.002003	0.866667	30	discard	tier1 ret_5d -0.015->-0.012
962	2.200695	3.002495	0.002003	0.888889	27	discard	tier1 ret_5d -0.015->-0.018
963	2.273350	3.123585	0.002003	0.892857	28	discard	add iv_disp to tier1
964	2.274170	3.124952	0.002003	0.892857	28	discard	fitted_vol clip [0.02,3.0] (identical)
965	2.274069	3.124952	0.002254	0.892857	28	discard	add log_m*sqrt_T basis (MAPE worse)
966	2.274071	3.124952	0.002251	0.892857	28	discard	add log_m linear basis (MAPE worse)
967	2.274170	3.124952	0.002003	0.892857	28	discard	tier1 dist_from_low 0.035->0.030 (identical)
968	2.230165	3.051610	0.002003	0.838710	31	discard	low window 20d->15d
969	2.245431	3.077054	0.002003	0.888889	27	discard	low window 20d->25d
970	2.274170	3.124952	0.002003	0.892857	28	discard	tier3 ret_5d -0.005->-0.003 (identical)
971	2.274170	3.124952	0.002003	0.892857	28	discard	tier3 ret_5d ->-0.008 (identical)
972	2.274170	3.124952	0.002003	0.892857	28	discard	tier3 ret_5d ->-0.015 (identical)
973	2.247932	3.081221	0.002003	0.884615	26	discard	tier3 ret_5d ->-0.025
974	2.114904	2.859509	0.002003	0.884615	26	discard	tier1 add ret_3d<0 condition
975	1.599330	2.000219	0.002003	0.838710	31	discard	tier2 iv_rv 1.6->1.55
976	2.242354	3.071926	0.002003	0.892857	28	discard	tier2 iv_rv 1.6->1.65
977	2.274156	3.124929	0.002003	0.892857	28	discard	tier1 base 0.15->0.155
978	2.274167	3.124947	0.002003	0.892857	28	discard	tier1 base 0.15->0.145
979	2.259856	3.101095	0.002003	0.862069	29	discard	skew_boost mult 0.9->0.92
980	2.249717	3.084198	0.002003	0.884615	26	discard	tier3 iv_rv 1.5->1.52
981	2.259478	3.100466	0.002003	0.884615	26	discard	tier1 add rv_5d>0.10
982	1.657441	2.097071	0.002003	0.787879	33	discard	ATM mask 0.05->0.04
983	1.600569	2.002284	0.002003	0.787879	33	discard	ATM mask 0.05->0.06
984	2.273276	3.123462	0.002003	0.892857	28	discard	low_scale power 0.8
985	2.273047	3.123080	0.002003	0.892857	28	discard	low_scale power 1.2
986	2.274241	3.125071	0.002003	0.892857	28	keep	add IV convexity (convex_boost) to tier1
987	2.274080	3.124801	0.002003	0.892857	28	discard	add convex_boost*0.5 to tier2
988	2.274221	3.125036	0.002003	0.892857	28	discard	convex_boost mult 1.5->2.0
989	2.274240	3.125069	0.002003	0.892857	28	discard	convex_boost mult 1.5->1.0
990	2.274241	3.125071	0.002003	0.892857	28	discard	convex_boost cap 0.2->0.15 (identical)
991	2.274203	3.125008	0.002003	0.892857	28	discard	OTM call threshold 1.08->1.05
992	2.274269	3.125118	0.002003	0.892857	28	keep	OTM call threshold 1.08->1.10
993	2.274269	3.125118	0.002003	0.892857	28	discard	OTM call threshold 1.10->1.12 (identical)
994	2.274303	3.125174	0.002003	0.892857	28	keep	OTM call threshold 1.10->1.15
995	2.274170	3.124952	0.002003	0.892857	28	discard	OTM call threshold 1.15->1.20
996	2.274315	3.125194	0.002003	0.892857	28	keep	tier1 convex_boost weight 1->1.5
997	2.274292	3.125155	0.002003	0.892857	28	discard	tier1 convex_boost weight 1.5->2.0
998	2.275430	3.127052	0.002003	0.892857	28	keep	add convex_boost*0.5 to tier3
