commit	combined_score	sharpe	mape	win_rate	n_trades	status	description
0c121c1	-0.606064	-1.517469	0.238957	0.421359	515	keep	baseline flat vol + simple IV/RV
ef29a4c	-0.511292	-1.517469	0.002026	0.421359	515	keep	IRLS vol surface fit (MAPE 24% -> 0.2%)
f7a5e5d	1.416742	1.695920	0.002026	0.909091	11	keep	longs only IV/RV>1.85 + 5d momentum (Sharpe 1.70)
-	1.180459	1.302115	0.002026	0.0	7	discard	IV/RV threshold 1.87
-	1.296209	1.495032	0.002026	0.846154	13	discard	IV/RV threshold 1.83
dffc16b	1.514619	1.859049	0.002026	0.846154	13	keep	ret_5d threshold -0.015 (Sharpe 1.86, 13 trades)
-	0.334545	-0.107741	0.002026	0.764706	17	discard	ret_5d threshold -0.01
-	1.413191	1.690003	0.002026	0.833333	12	discard	ret_5d threshold -0.018
-	1.514619	1.859049	0.002026	0.846154	13	discard	IV/RV threshold 1.84 (same)
-	1.188302	1.315188	0.002026	0.800000	10	discard	add 3d return filter
-	1.514619	1.859049	0.002026	0.846154	13	discard	20d return filter <0.05 (no effect)
-	1.270243	1.451756	0.002026	0.857143	7	discard	IV>0.30 filter
f38510d	1.682178	2.138314	0.002026	0.771429	35	keep	add moderate fear signal IV/RV>1.5 ret5d<-4% (Sharpe 2.14)
-	1.446379	1.745317	0.002026	0.673469	49	discard	moderate signal ret5d<-3%
-	1.528047	1.881428	0.002026	0.769231	26	discard	moderate signal ret5d<-5%
-	1.652545	2.088925	0.002026	0.771429	35	discard	moderate signal strength 0.2
8eb1838	1.692047	2.154763	0.002026	0.771429	35	keep	moderate signal strength 0.4 (Sharpe 2.15)
-	1.688027	2.148062	0.002026	0.771429	35	discard	moderate signal strength 0.5
-	1.232903	1.389523	0.002026	0.680000	50	discard	moderate IV/RV threshold 1.4
bc710ef	1.703787	2.174329	0.002026	0.761905	21	keep	moderate IV/RV threshold 1.6 (Sharpe 2.17, 21 trades)
-	1.541737	1.904246	0.002026	0.750000	16	discard	moderate IV/RV threshold 1.7
-	1.529639	1.884083	0.002026	0.592593	54	discard	3rd tier IV/RV>1.3 ret5d<-6% str=0.1
-	1.540230	1.901733	0.002026	0.708333	24	discard	moderate ret5d -0.035
a07639d	1.725942	2.211255	0.002026	0.842105	19	keep	moderate ret5d -0.045 (Sharpe 2.21, 84% win, 19 trades)
-	1.570583	1.952322	0.002026	0.812500	16	discard	moderate ret5d -0.05
-	1.623149	2.039933	0.002026	0.800000	25	discard	moderate IV/RV 1.55
-	1.707516	2.180544	0.002026	0.875000	16	discard	moderate IV/RV 1.65
-	1.725942	2.211255	0.002026	0.842105	19	discard	near-term IV spike signal (no effect)
-	1.707724	2.180891	0.002026	0.842105	19	discard	moderate strength 0.35
24d31d9	1.741720	2.237551	0.002026	0.842105	19	keep	moderate strength 0.45 (Sharpe 2.24, 84% win, 19 trades)
cc484c5	1.755116	2.259877	0.002026	0.842105	19	keep	moderate strength 0.50 (Sharpe 2.26)
3868b5b	1.766213	2.278373	0.002026	0.842105	19	keep	moderate strength 0.55 (Sharpe 2.28)
ba16b7c	1.775124	2.293224	0.002026	0.842105	19	keep	moderate strength 0.60 (Sharpe 2.29)
34e285d	1.786907	2.312863	0.002026	0.842105	19	keep	moderate strength 0.70 (Sharpe 2.31)
cdad43a	1.791623	2.320722	0.002026	0.842105	19	keep	moderate strength 0.80 (Sharpe 2.32)
-	1.790496	2.318845	0.002026	0.842105	19	discard	moderate strength 0.90
-	1.791623	2.320722	0.002026	0.842105	19	discard	IV pre-filter [0.10,1.5] (no change)
-	1.791623	2.320722	0.002026	0.842105	19	discard	moderate+10d filter (no effect)
-	1.544838	1.909415	0.002026	0.772727	22	discard	extreme threshold 1.82
-	1.791623	2.320722	0.002026	0.842105	19	discard	IRLS 30 iter (no change)
-	1.791623	2.320722	0.002026	0.842105	19	discard	deep selloff bounce signal (never fired)
-	1.318922	1.532887	0.002026	0.791667	24	discard	IV/RV>1.5 ret5d<-6%
-	1.781639	2.304082	0.002026	0.0	20	discard	moderate ret5d -0.042
-	1.715877	2.194479	0.002026	0.0	18	discard	moderate ret5d -0.048
-	1.715966	2.194628	0.002026	0.714286	35	discard	vol acceleration signal
-	1.790873	2.319472	0.002026	0.842105	19	discard	extreme strength 0.9
-	0.296804	-0.170643	0.002026	0.548387	31	discard	continuous fear score
-	1.593559	1.990617	0.002026	0.809524	21	discard	extreme ret5d -0.012
-	0.478208	0.131697	0.002026	0.441176	68	discard	20d RV window (too many false signals)
-	1.006027	1.011396	0.002026	0.509804	51	discard	30d RV window
-	1.791623	2.320722	0.002026	0.842105	19	discard	min 3 ATM options filter (no effect)
-	0.241637	-0.262588	0.002026	0.800000	10	discard	10d return window (ret_10d thresholds -0.03/-0.08)
-	1.369975	1.617976	0.002026	0.750000	24	discard	weighted median ATM IV
-	1.703311	2.173536	0.002026	0.875000	16	discard	call-only ATM IV
-	1.533723	1.890888	0.002026	0.866667	15	discard	1d negative return filter (too restrictive)
-	1.270241	1.451752	0.002026	0.714286	28	discard	75th percentile ATM IV
70098e4	1.814664	2.359124	0.002026	0.933333	15	keep	near-20d-low filter dist<3% (Sharpe 2.36, 93% win, 15 trades)
-	1.725954	2.211274	0.002026	0.882353	17	discard	dist_from_low 5% (too loose)
-	1.748157	2.248280	0.002026	0.928571	14	discard	dist_from_low 2% (too tight)
-	1.727173	2.213305	0.002026	0.833333	18	discard	dist_from_low only on extreme tier
-	1.706952	2.179605	0.002026	0.875000	16	discard	dist_from_low 4%
-	1.700311	2.168536	0.002026	0.833333	18	discard	dist from 10d low (20d better)
94fd804	1.836918	2.396215	0.002026	0.933333	15	keep	continuous low-distance scaling (Sharpe 2.40, 93% win)
-	1.805616	2.344045	0.002026	0.933333	15	discard	low_scale denominator 0.03
-	1.837264	2.396790	0.002026	0.933333	15	discard	low_scale denominator 0.07 (marginal)
-	1.814548	2.358931	0.002026	0.875000	16	discard	remove dist_from_low hard cutoff (continuous only)
-	1.828600	2.382351	0.002026	0.933333	15	discard	IV/RV ratio strength scaling
-	1.831772	2.387637	0.002026	0.933333	15	discard	moderate strength 0.85
-	1.794341	2.325253	0.002026	1.000000	12	discard	drawdown>3%/5% filter (100% win but too few trades)
-	1.836822	2.396215	0.002266	0.933333	15	discard	add log_m*sqrt_T cross term (MAPE slightly worse)
-	1.806600	2.345684	0.002026	0.933333	15	discard	drawdown scaling (low_scale*dd_scale)
-	1.646770	2.079302	0.002026	1.000000	9	discard	IV/RV threshold 1.90 (too selective)
-	1.809352	2.350271	0.002026	0.933333	15	discard	exponential low_scale exp(-d*50)
-	1.836870	2.396215	0.002147	0.933333	15	discard	IRLS tuning 1.0 MAD (MAPE slightly worse)
-	1.451799	1.754349	0.002026	0.888889	9	discard	vol_rising filter (too restrictive)
-	0.924956	0.876278	0.002026	0.522727	44	discard	single tier IV/RV>1.6 ret5d<-0.015 (too loose)
-	1.701143	2.169922	0.002026	0.933333	15	discard	ret_5d magnitude scaling
-	1.537922	1.897887	0.002026	0.909091	11	discard	3d return for extreme tier (too few trades)
-	1.744846	2.242760	0.002026	1.000000	11	discard	min RV 0.15 (too few trades)
-	1.480815	1.802709	0.002026	0.857143	21	discard	moderate IV/RV 1.55 (too loose)
-	1.836918	2.396215	0.002026	0.933333	15	discard	IV term structure bonus (never fires, 3s slower)
-	1.810005	2.351359	0.002026	0.933333	15	discard	quadratic low_scale
-	1.749132	2.249904	0.002026	1.000000	13	discard	extreme ret_5d -0.02 (too strict)
-	0.687579	0.480649	0.002026	0.833333	18	discard	extreme ret_5d -0.01 (too loose, bad trades)
-	1.835327	2.393562	0.002026	0.933333	15	discard	sqrt low_scale
-	1.836918	2.396215	0.002026	0.933333	15	discard	moderate dist_from_low 0.02 (no change)
-	1.787431	2.313736	0.002026	0.823529	17	discard	moderate ret_5d -0.04
-	1.836580	2.396215	0.002871	0.933333	15	discard	abs(log_m) basis term (MAPE worse)
-	1.565467	1.943796	0.002026	0.937500	16	discard	ATM window 0.03 (worse signal)
-	1.836918	2.396215	0.002026	0.933333	15	discard	low_scale min 0.3 (no change)
-	1.565384	1.943657	0.002026	0.909091	11	discard	OTM put skew filter on moderate tier
-	1.830720	2.385885	0.002026	0.875000	16	discard	3rd tier IV/RV>2.0 ret5d<-0.03 dist<0.06
-	1.758736	2.265910	0.002026	0.833333	18	discard	15d low window
06cf9a8	1.840785	2.402660	0.002026	0.933333	15	keep	moderate strength 0.75 (Sharpe 2.40, 93% win)
6ff4dda	1.843127	2.406563	0.002026	0.933333	15	keep	moderate strength 0.70 (Sharpe 2.41, 93% win)
6a69eae	1.843675	2.407476	0.002026	0.933333	15	keep	moderate strength 0.65 (Sharpe 2.41, score 1.844)
-	1.842137	2.404912	0.002026	0.933333	15	discard	moderate strength 0.60
-	1.843508	2.407197	0.002026	0.933333	15	discard	extreme strength 0.95
-	1.842101	2.404853	0.002026	0.933333	15	discard	low_scale denominator 0.06
-	1.840868	2.402797	0.002026	0.933333	15	discard	low_scale denominator 0.04
-	1.656498	2.095514	0.002026	0.916667	12	discard	moderate ret_5d -0.05 (too few trades)
-	1.842291	2.405170	0.002026	0.933333	15	discard	extreme strength 0.90
-	1.843675	2.407476	0.002026	0.933333	15	discard	IV mean/median skew bonus (never fires)
-	1.843675	2.407476	0.002026	0.933333	15	discard	below 20d SMA filter (no effect)
-	1.842823	2.407476	0.004157	0.933333	15	discard	maturity-split IRLS (MAPE worse, slower)
-	1.558781	1.932653	0.002026	0.928571	14	discard	trimmed mean ATM IV
-	1.843247	2.406762	0.002026	0.933333	15	discard	low_scale denominator 0.045
-	1.843129	2.406565	0.002026	0.933333	15	discard	low_scale denominator 0.055
-	1.834946	2.392927	0.002026	0.875000	16	discard	3rd tier IV/RV>2.0 dist<0.05 str=0.4
-	1.843675	2.407476	0.002026	0.933333	15	discard	tighter IV filter 0.08-1.5 (no change)
-	1.843675	2.407476	0.002026	0.933333	15	discard	vol surface residual stress scaling
-	1.813803	2.357690	0.002026	0.928571	14	discard	moderate IV/RV 1.65
-	1.843675	2.407476	0.002026	0.933333	15	discard	IV solver 40 iter tol 1e-10 (no change)
-	0.830449	0.718765	0.002026	0.444444	45	discard	RMS-based realized vol (too many trades)
-	1.699900	2.167852	0.002026	0.833333	18	discard	extreme IV/RV 1.80 (too loose)
-	1.808658	2.349115	0.002026	0.928571	14	discard	25d low window
-	1.843675	2.407476	0.002026	0.933333	15	discard	max daily loss filter (no effect)
-	1.277708	1.464198	0.002026	0.708333	24	discard	continuous fear formula (poor discrimination)
-	1.843327	2.406896	0.002026	0.933333	15	discard	moderate strength 0.63
aa44650	1.843689	2.407500	0.002026	0.933333	15	keep	moderate strength 0.67 (score 1.8437)
-	1.294729	1.492566	0.002026	0.846154	13	discard	short-dated ATM IV for signal
-	1.823965	2.374625	0.002026	0.933333	15	discard	drawdown boost on extreme tier
-	1.843689	2.407500	0.002026	0.933333	15	discard	moderate ret_5d -0.043 (no change)
-	1.674746	2.125927	0.002026	1.000000	10	discard	extreme IV/RV 1.87 (too selective)
-	1.843578	2.407314	0.002026	0.933333	15	discard	moderate strength 0.68
578e2b8	1.843723	2.407555	0.002026	0.933333	15	keep	moderate strength 0.66 (score 1.8437)
-	1.379659	1.634116	0.002026	0.857143	14	discard	consecutive down days instead of dist_from_low
-	1.832698	2.389181	0.002026	0.875000	16	discard	acceleration-based 3rd tier
-	1.843594	2.407555	0.002347	0.933333	15	discard	T basis term (MAPE slightly worse)
-	1.843628	2.407555	0.002263	0.933333	15	discard	log_m linear basis (MAPE slightly worse)
-	1.843723	2.407555	0.002026	0.933333	15	discard	IV rank boost on extreme tier (no effect)
-	1.843723	2.407555	0.002026	0.933333	15	discard	IRLS min good=5 (no change)
-	1.842836	2.406078	0.002026	0.933333	15	discard	IV IQR dispersion scaling
-	1.843510	2.407555	0.002558	0.933333	15	discard	Huber loss IRLS (MAPE slightly worse)
-	1.556098	1.928181	0.002026	0.928571	14	discard	blended median/mean ATM IV
-	1.843723	2.407555	0.002026	0.933333	15	discard	extreme ret_5d -0.013 (no change)
-	1.843723	2.407555	0.002026	0.933333	15	discard	dist_from_low 0.025 (no change)
-	1.843586	2.407555	0.002367	0.933333	15	discard	Tikhonov regularized IRLS
-	1.753302	2.256854	0.002026	0.928571	14	discard	extreme ret_5d -0.017 (loses 1 trade)
-	0.615291	0.360169	0.002026	0.494253	87	discard	fitted ATM vol for signal (completely wrong IV readings)
-	1.015303	1.026856	0.002026	1.000000	2	discard	min ATM IV (too conservative)
-	1.753302	2.256854	0.002026	0.928571	14	discard	extreme ret_5d -0.016 (loses 1 trade)
-	0.964402	0.942021	0.002026	0.544828	145	discard	sigmoid composite score (way too many trades)
-	0.340470	-0.097866	0.002026	0.769231	13	discard	ret_7d window (completely different signals)
-	1.843723	2.407555	0.002026	0.933333	15	discard	40d IV/RV confirmation (no effect)
-	1.843544	2.407257	0.002026	0.933333	15	discard	moderate strength 0.64
-	1.243689	1.407499	0.002026	0.550000	20	discard	EWMA realized vol
-	1.843723	2.407555	0.002026	0.933333	15	discard	IV/RV>3.0 data quality filter (no effect)
-	1.843723	2.407555	0.002026	0.933333	15	discard	min 30d history (no effect)
3528000	1.844179	2.412058	0.007641	1.000000	14	keep	moneyness IV initial guess (Sharpe 2.41, 100% win, score 1.844)
0079a2e	1.846424	2.412058	0.002026	1.000000	14	keep	separate signal IV solver (Sharpe 2.41, 100% win, MAPE 0.2%, score 1.846)
a32708e	1.846424	2.412058	0.002026	1.000000	14	keep	signal IV 10 iter (same score, 3s faster)
-	1.845775	2.410977	0.002026	1.000000	14	discard	moderate strength 0.70 (with new IV solver)
-	1.843723	2.407555	0.002026	0.933333	15	discard	signal IV init coeff 0.35
-	1.846424	2.412058	0.002026	1.000000	14	discard	signal IV init coeff 0.45 (no change)
-	1.750434	2.252074	0.002026	0.882353	17	discard	extreme IV/RV 1.83 with new solver
-	1.845776	2.410978	0.002026	1.000000	14	discard	moderate strength 0.62 (new solver)
-	1.846424	2.412058	0.002026	1.000000	14	discard	Brenner-Subrahmanyam IV approx for signal initial guess
-	1.243689	1.407499	0.002026	0.550000	20	discard	EWMA realized vol lambda=0.94
-	0.882642	0.805755	0.002026	0.440000	50	discard	20-day RV window
-	1.211033	1.353073	0.002026	0.564103	39	discard	30-day RV window
-	1.846424	2.412058	0.002026	1.000000	14	discard	ultra-extreme tier IV/RV>2.2 ret_5d<-0.005
-	1.846424	2.412058	0.002026	1.000000	14	discard	dist_from_10d_high>0.01 filter
-	1.711835	2.187743	0.002026	1.000000	11	discard	dist_from_10d_high>0.03 filter
-	1.846424	2.412058	0.002026	1.000000	14	discard	put-call skew boost
-	1.846328	2.412058	0.002266	1.000000	14	discard	add log_m*sqrt_T basis term
-	1.846330	2.412058	0.002263	1.000000	14	discard	add linear log_m basis term
-	1.846424	2.412058	0.002026	1.000000	14	discard	IV term structure boost (slower)
-	1.830229	2.385067	0.002026	1.000000	14	discard	continuous IV/RV strength scaling
-	1.601571	2.003969	0.002026	0.875000	16	discard	vega-weighted ATM IV
-	0.859933	0.767907	0.002026	0.875000	16	discard	ret_10d<-0.06 for moderate tier
-	1.846212	2.412058	0.002558	1.000000	14	discard	Huber weights in IRLS
-	1.846376	2.412058	0.002147	1.000000	14	discard	Cauchy MAD scaling 1.0
-	1.846424	2.412058	0.002026	1.000000	14	discard	OTM put skew fear tier (not triggered)
-	1.832754	2.389274	0.002026	0.863636	22	discard	relaxed OTM put skew fear tier
-	1.845819	2.412058	0.003540	1.000000	14	discard	80/20 blend surface/raw IV
-	1.846424	2.412058	0.002026	1.000000	14	discard	IRLS 40 iterations (no improvement)
-	1.279660	1.467451	0.002026	0.619469	113	discard	momentum tier IV/RV<0.9 ret_5d>0.02
-	1.829532	2.383904	0.002026	0.894737	19	discard	20-day RV tier iv_rv20>2.5
-	1.668826	2.116061	0.002026	1.000000	12	discard	add ret_3d<0 filter
-	1.236563	1.395622	0.002026	0.653846	26	discard	continuous composite scoring
-	1.844179	2.412058	0.007641	1.000000	14	discard	intrinsic-based IV initial guess for pricing
-	1.845417	2.412058	0.004545	1.000000	14	discard	separate call/put vol surface fits
-	1.846424	2.412058	0.002026	1.000000	14	discard	IV solver 30 iters tol=1e-10
-	1.846424	2.412058	0.002027	1.000000	14	discard	good IV threshold 0.03
-	1.845881	2.412058	0.003385	1.000000	14	discard	cubic log_m^3 basis term
-	1.845769	2.412058	0.003664	1.000000	14	discard	linear T basis instead of sqrt_T
-	1.843144	2.406591	0.002026	1.000000	14	discard	low_scale denom 0.04
-	1.845167	2.409962	0.002026	1.000000	14	discard	low_scale denom 0.06
-	1.825658	2.377448	0.002026	1.000000	14	discard	quadratic low_scale
-	1.562549	2.412058	0.711714	1.000000	14	discard	log_m^2/sqrt_T basis (lost skew)
-	0.504702	0.175854	0.002026	0.478261	46	discard	short signal complacency near highs
-	1.816049	2.361433	0.002026	0.800000	20	discard	moderate ret_5d<-0.03 dist_from_low<0.005
-	1.644533	2.075573	0.002026	0.933333	15	discard	tier3 IV/RV>2.0 ret_5d<-0.01 dfl<0.01
-	1.716607	2.195695	0.002026	0.809524	21	discard	tier3 IV/RV>1.7 ret_5d<-0.02 dfl<0.001
-	1.825195	2.376676	0.002026	0.933333	15	discard	tier3 IV/RV>1.8 ret_5d<-0.02 dfl<0.001
-	1.838196	2.398344	0.002026	1.000000	14	discard	concave low_scale exponent 0.7
-	1.841801	2.412058	0.013586	1.000000	14	discard	fair value floor 0.005
-	1.846415	2.412058	0.002049	1.000000	14	discard	floor matching for cheap options
-	1.633748	2.057598	0.002026	0.937500	16	discard	extreme ret_5d threshold -0.012
-	1.846424	2.412058	0.002026	1.000000	14	discard	signal IV 15 iterations (no improvement)
0f06010	1.846428	2.412058	0.002018	1.000000	14	keep	ridge regularization lambda=1e-4 in IRLS
-	1.846361	2.412058	0.002185	1.000000	14	discard	ridge lambda=1e-3
-	1.846427	2.412058	0.002021	1.000000	14	discard	ridge lambda=5e-5
-	1.846428	2.412058	0.002016	1.000000	14	discard	ridge lambda=2e-4 (same combined)
-	1.846427	2.412058	0.002021	1.000000	14	discard	ridge lambda=3e-4
-	1.846428	2.412058	0.002017	1.000000	14	discard	no-intercept ridge penalty
-	1.846424	2.412058	0.002026	1.000000	14	discard	Tikhonov variance-scaled ridge
-	1.846428	2.412058	0.002016	1.000000	14	discard	good IV upper bound 1.5
-	1.845587	2.412058	0.004120	1.000000	14	discard	shrink deep OTM toward market price
-	1.846300	2.412058	0.002337	1.000000	14	discard	T^2 basis function
-	1.844648	2.412058	0.006467	1.000000	14	discard	1/sqrt_T basis instead of sqrt_T
-	1.845683	2.412058	0.003880	1.000000	14	discard	log_T basis instead of sqrt_T
-	1.846428	2.412058	0.002016	1.000000	14	discard	sqrt_T-0.3 centering (same score)
ae9ab58	1.846429	2.412058	0.002016	1.000000	14	keep	tighter IV filter [0.10, 1.0]
-	1.846429	2.412058	0.002016	1.000000	14	discard	IV filter [0.08, 1.2]
-	1.846429	2.412058	0.002016	1.000000	14	discard	min count threshold 10
-	1.843727	2.407555	0.002016	0.933333	15	discard	signal IV init guess scaling 0.35
-	1.846429	2.412058	0.002016	1.000000	14	discard	signal IV init guess scaling 0.45
-	1.843727	2.407555	0.002016	0.933333	15	discard	damped Newton for signal IV
-	1.553283	1.923482	0.002016	0.842105	19	discard	weighted median ATM IV
-	1.435697	1.727505	0.002016	0.916667	12	discard	near-term only ATM IV
-	1.756122	2.261548	0.002016	1.000000	13	discard	extreme ret_5d threshold -0.016
-	1.846429	2.412058	0.002016	1.000000	14	discard	ret_5d threshold -0.014/-0.0149
-	1.845780	2.410977	0.002016	1.000000	14	discard	moderate strength 0.70
-	1.846429	2.412058	0.002016	1.000000	14	discard	good-data count threshold 6
-	1.553283	1.923482	0.002016	0.842105	19	discard	ATM moneyness 0.04
-	1.846429	2.412058	0.002016	1.000000	14	discard	log_m^4 basis with ridge
-	1.846395	2.412058	0.002099	1.000000	14	discard	log_m^2*sqrt_T interaction basis
-	1.447235	2.412058	42.887976	1.000000	14	discard	Newton correction 10pct toward market
-	1.846367	2.412058	0.002170	1.000000	14	discard	per-option vol clamp [0.5iv, 2iv]
-	1.846429	2.412058	0.002016	1.000000	14	discard	exact-low tier IV/RV>1.85 ret_5d<-0.005
-	1.844280	2.412058	0.007388	1.000000	14	discard	per-expiry bucket IRLS fits
-	1.846042	2.412058	0.002983	1.000000	14	discard	abs(log_m) V-shape instead of quadratic
-	1.446682	1.745814	0.002016	0.900000	10	discard	mean ATM IV instead of median
-	1.556102	1.928181	0.002016	0.928571	14	discard	trimmed mean ATM IV
-	1.810006	2.351353	0.002016	1.000000	13	discard	25-day low instead of 20-day
-	1.769922	2.284547	0.002016	0.882353	17	discard	15-day low instead of 20-day
-	1.771149	2.286592	0.002016	1.000000	12	discard	call-only ATM IV for signal
-	1.674734	2.125901	0.002016	1.000000	10	discard	bias-corrected RV (ddof=1)
-	1.846429	2.412058	0.002016	1.000000	14	discard	IRLS early stopping (same score, slower)
-	1.827662	2.412058	0.048932	1.000000	14	discard	bias correction on IRLS residuals
-	1.846429	2.412058	0.002016	1.000000	14	discard	cap fair value at 2x market
-	1.846428	2.412058	0.002017	1.000000	14	discard	step-limited Newton IV solver
-	1.846426	2.412058	0.002022	1.000000	14	discard	Halley method IV solver
-	1.610185	2.018319	0.002016	0.705882	51	discard	absolute IV>0.45 tier
-	0.647216	0.413370	0.002016	0.882353	17	discard	adaptive ret_5d threshold by IV/RV
-	1.536412	1.895364	0.002016	0.909091	11	discard	3-day return for extreme tier
-	1.844949	2.412058	0.005716	1.000000	14	discard	vega-weighted IRLS
-	1.838672	2.399130	0.002016	1.000000	14	discard	sqrt low_scale for extreme tier
-	1.846427	2.412058	0.002021	1.000000	14	discard	ensemble vol surface (avg two ridge lambdas)
-	1.601575	2.003969	0.002016	0.875000	16	discard	vega-weighted mean ATM IV
-	0.890772	0.819297	0.002016	0.617647	34	discard	EWMA realized vol (lambda=0.94)
-	1.696429	2.162059	0.002016	1.000000	11	discard	percentile rank in 20d range
-	1.846429	2.412058	0.002016	1.000000	14	discard	OLS-init IRLS (same result)
-	1.712580	2.188977	0.002016	1.000000	12	discard	IV confidence multiplier from ATM IV spread
-	1.846429	2.412058	0.002016	1.000000	14	discard	30 IV solver iterations (same result)
-	1.846304	2.412058	0.002328	1.000000	14	discard	vol surface bias correction
-	1.846429	2.412058	0.002016	1.000000	14	discard	ridge lambda=1.5e-4 (same score)
-	1.846275	2.412058	0.002400	1.000000	14	discard	Huber loss IRLS weights
-	1.846429	2.412058	0.002016	1.000000	14	discard	centered sqrt_T-0.3 basis (same)
-	1.846429	2.412058	0.002016	1.000000	14	discard	IV term structure 3rd tier (no new trades)
-	1.845837	2.412058	0.003495	1.000000	14	discard	blend surface+raw IV for outliers
-	1.846429	2.412058	0.002016	1.000000	14	discard	Halley method IV solver (same result, faster)
-	1.846418	2.412058	0.002041	1.000000	14	discard	tighter IV filter [0.08, 0.8]
-	1.846429	2.412058	0.002016	1.000000	14	discard	IV filter [0.08, 1.2] (same score)
-	1.846429	2.412058	0.002016	1.000000	14	discard	OTM put skew boost (no effect)
